{
  "field": {
    "defining_polynomial": [
      1,
      -12,
      66,
      -216,
      467,
      -724,
      1040,
      -2244,
      6365,
      -15960,
      32494,
      -54820,
      78675,
      -97416,
      104584,
      -97416,
      78675,
      -54820,
      32494,
      -15960,
      6365,
      -2244,
      1040,
      -724,
      467,
      -216,
      66,
      -12,
      1
    ],
    "generator": "t"
  },
  "map": {
    "denominator": [
      [
        "865739683712258503305782092263086514129324838878111544957229494394590623830470802690701066228019/794380164951833802147208862809435458984808064997196197509765625000000",
        "-22902429978128910647987841536271225703315836026305343190933028018410274036294307094126388481564267/14298842969133008438649759530569838261726545169949531555175781250000000",
        "-2510964386504471685090139328251698238064269120742304955249462061550432238412261148897313618452229/166265615920151260914532087564765561182866804301738739013671875000000",
        "15764237173732056771580890652960488678767639057331719686132264325185972799664829995667336009064863/190651239588440112515330127074264510156353935599327087402343750000000",
        "-170919993430947722496495106463043570825526615182556795127399811840815634034489618891616188524138721/893677685570813027415609970660614891357909073121845722198486328125000",
        "1766486506265423344171014690353290009133060734739864659263552694986469775811323019135821725224487373/7149421484566504219324879765284919130863272584974765777587890625000000",
        "-749118461363494958829000131711335156879783985820239638614674431752729769448674509694229876316828233/3574710742283252109662439882642459565431636292487382888793945312500000",
        "3342965445510188750873177311120956145253492609383689602603348432183267997924559762804483871104067791/7149421484566504219324879765284919130863272584974765777587890625000000",
        "-554361478204135730480227028258237914411017376643597616901207839987269521798006206997868941430081641/285976859382660168772995190611396765234530903398990631103515625000000",
        "80695955608416737040682799904967994403476063422239593450384645126209185067872411860503463645500536187/14298842969133008438649759530569838261726545169949531555175781250000000",
        "-28504052147311528815489827886028558509938556071601666612078258372031612464129873255578634168837362831/2383140494855501406441626588428306376954424194991588592529296875000000",
        "96557583657319852697854230598109934503369264469313566797101525871373503993441639365077919201950967201/4766280989711002812883253176856612753908848389983177185058593750000000",
        "-25635112285204145394853195331657949223060460408697925093355781804676619679086397561934750703283571087/893677685570813027415609970660614891357909073121845722198486328125000",
        "24705518666295389967586978073413217230938202722756040097002639122647445624580344747009135898728890089/714942148456650421932487976528491913086327258497476577758789062500000",
        "-1412324168906090693431834733460007876744721697503459720866608905006955562029365370493223808088498657/39719008247591690107360443140471772949240403249859809875488281250000",
        "112097568276529552252763891375912355160473390011951926791278718825501518518046032640754835497312077153/3574710742283252109662439882642459565431636292487382888793945312500000",
        "-33906654049687412270323795120055226064222441129513620378215173463168218836738438178483474982892088243/1429884296913300843864975953056983826172654516994953155517578125000000",
        "72673306870351657391011144192677010415341041458941899230419224448176988183601329543328048083075904089/4766280989711002812883253176856612753908848389983177185058593750000000",
        "-19316525506130822257551647607579932120367218915262579357050962827363793913336174649749187756137300831/2383140494855501406441626588428306376954424194991588592529296875000000",
        "48836113009383153776826608380457333194861857354977066914711101238902781297026851186636017684397114203/14298842969133008438649759530569838261726545169949531555175781250000000",
        "-2036634566969006224218114383273926572320077629792441356234765674525353951092955707688691552944949819/1787355371141626054831219941321229782715818146243691444396972656250000",
        "3033568936608633923816134570361973549557023337703304258482839390393590410752691780104063820266362507/7149421484566504219324879765284919130863272584974765777587890625000000",
        "-1051807636081827648370426355354937905224902404876336002006338465459317276388387818503760500468422971/3574710742283252109662439882642459565431636292487382888793945312500000",
        "1583682555250803364422514343663272544836305403494017623638228392682596671736122616568500765738562017/7149421484566504219324879765284919130863272584974765777587890625000000",
        "-838622701679852745269968352973539832550877446770757914731721348012089316785520634849412815087017731/7149421484566504219324879765284919130863272584974765777587890625000000",
        "189868831868282034378881117863154655483942393906514693668765163590664758878444638303285633441104871/4766280989711002812883253176856612753908848389983177185058593750000000",
        "-56286758925693183859166392320588957628360852596069622242036291102208257504403706442331721748586231/7149421484566504219324879765284919130863272584974765777587890625000000",
        "10067236660176431600084345249197316311293886560850852743941748435731523562549571095856059227411709/14298842969133008438649759530569838261726545169949531555175781250000000"
      ],
      [
        "14862367026476209394136041506952488453585992896335505841417606044868151569720684939073135503997189/285976859382660168772995190611396765234530903398990631103515625000000",
        "-265083709705311143359474444781276201257829110577818575476853731444562546541292712315107430121146833/571953718765320337545990381222793530469061806797981262207031250000000",
        "546802230459266450640664468676203475232056061363881838822424431739492938424319938168638073725103987/285976859382660168772995190611396765234530903398990631103515625000000",
        "-108066236089121678565865473118063706593059961523759922440232474024698917578644806116308821683810029/22878148750612813501839615248911741218762472271919250488281250000000",
        "91831071590012366891445544773100821214814972365956202543868990860849927904855940402760542840390287/11915702474277507032208132942141531884772120974957942962646484375000",
        "-66377983684832455816385742269876655898956087484616463054514736276087918430979062193576954233652411/6650624636806050436581283502590622447314672172069549560546875000000",
        "7837626469738951986864237918064832122402997167069878639442892226451986052450302188908399860444361/429394683757748001160653439356451599451247602701187133789062500000",
        "-5131424813789836306361342447860377891561191358600476479812348171881770471852375518670457697617027917/95325619794220056257665063537132255078176967799663543701171875000000",
        "8423144026825546909857238628911622708215236922915144433235945659480789846620977590258289989572320709/57195371876532033754599038122279353046906180679798126220703125000000",
        "-183078531388902135324637728429347300119043992888319339600854168022912171528558747429170800366001718287/571953718765320337545990381222793530469061806797981262207031250000000",
        "17980152341236801436305745924008377866709685554553854927652638895711592072201183377259817262250616017/31775206598073352085888354512377418359392322599887847900390625000000",
        "-11201425626552964136282642978064257671633192605591714481387316740191451386661260608523416307189047561/13301249273612100873162567005181244894629344344139099121093750000000",
        "38424761777799915051826610871836286046975536134887540345774120387944142762535723774367418027653963797/35747107422832521096624398826424595654316362924873828887939453125000",
        "-33877835509440288352814321443014989834143810577329409079475423782828115346182970636930702285577379057/28597685938266016877299519061139676523453090339899063110351562500000",
        "3228102183051751276087741107427190733973375040550206122255652001511591659009690769470640687195374461/2859768593826601687729951906113967652345309033989906311035156250000",
        "-133012297675838448426024311483490253138515260408017164613813051317056111306386898339617246527959455333/142988429691330084386497595305698382617265451699495315551757812500000",
        "37778962704086391326090839839006114103322117385864740531951071991892686036036520152443263314448865027/57195371876532033754599038122279353046906180679798126220703125000000",
        "-25342680181255977847646535777264369591700566054905122153970936708532375025964793404337854340110379463/63550413196146704171776709024754836718784645199775695800781250000000",
        "56956038492686400686084002565430384926086099303092854150513565073423451975594346808000936032533855953/285976859382660168772995190611396765234530903398990631103515625000000",
        "-45815190735762727313743858222987227579495008365588039309808414130163455903967338642175244774456194523/571953718765320337545990381222793530469061806797981262207031250000000",
        "659948998860992958276387927184625026098906640351432357222700540267430850729320383913561052778459113/23831404948555014064416265884283063769544241949915885925292968750000",
        "-1171784843986418417645791586584888236832533719049794210021033958147408685666909797768202412960963789/95325619794220056257665063537132255078176967799663543701171875000000",
        "1235060678225155900811366508163512890120038287285856292807173463055196293054054254172612291678474991/142988429691330084386497595305698382617265451699495315551757812500000",
        "-61013090663702824031852424860809206714590319714799320163682138332506356501490583400658586111791011/10591735532691117361962784837459139453130774199962615966796875000000",